{
  "schemaVersion": "1.0.0",
  "metadata": {
    "name": "Invoice — Acme Corp",
    "id": "fixture-invoice-0001",
    "createdAt": "2026-06-17T00:00:00.000Z",
    "locale": "en-US"
  },
  "page": {
    "size": "A4",
    "orientation": "portrait",
    "marginsMm": {
      "top": 20,
      "right": 15,
      "bottom": 20,
      "left": 15
    },
    "units": "mm",
    "defaultFont": {
      "family": "Inter",
      "sizePt": 10
    },
    "background": null
  },
  "header": {
    "elements": [
      {
        "id": "el_inv_logo",
        "type": "image",
        "frame": {
          "xMm": 15,
          "yMm": 12,
          "wMm": 40,
          "hMm": 14
        },
        "src": "https://assets.rendara.dev/acme-logo.png",
        "fit": "contain",
        "z": 1
      }
    ]
  },
  "body": {
    "elements": [
      {
        "id": "el_inv_title",
        "type": "text",
        "frame": {
          "xMm": 15,
          "yMm": 16,
          "wMm": 100,
          "hMm": 12
        },
        "text": "INVOICE",
        "style": {
          "font": {
            "family": "Inter",
            "sizePt": 24,
            "weight": "bold",
            "style": "normal"
          },
          "color": "#4F46E5",
          "align": {
            "horizontal": "left",
            "vertical": "middle"
          }
        },
        "z": 1
      },
      {
        "id": "el_inv_number",
        "type": "text",
        "frame": {
          "xMm": 130,
          "yMm": 18,
          "wMm": 65,
          "hMm": 8
        },
        "binding": {
          "expr": "invoice.number",
          "format": null,
          "fallback": ""
        },
        "style": {
          "align": {
            "horizontal": "right",
            "vertical": "middle"
          }
        },
        "z": 1
      },
      {
        "id": "el_inv_date",
        "type": "text",
        "frame": {
          "xMm": 130,
          "yMm": 26,
          "wMm": 65,
          "hMm": 6
        },
        "binding": {
          "expr": "invoice.date",
          "format": "date:medium",
          "fallback": ""
        },
        "style": {
          "align": {
            "horizontal": "right",
            "vertical": "middle"
          }
        },
        "z": 1
      },
      {
        "id": "el_inv_bill_to_label",
        "type": "text",
        "frame": {
          "xMm": 15,
          "yMm": 38,
          "wMm": 80,
          "hMm": 5
        },
        "text": "Bill To",
        "style": {
          "font": {
            "weight": "bold"
          }
        },
        "z": 1
      },
      {
        "id": "el_inv_customer",
        "type": "text",
        "frame": {
          "xMm": 15,
          "yMm": 44,
          "wMm": 90,
          "hMm": 6
        },
        "binding": {
          "expr": "invoice.customer.name",
          "format": null,
          "fallback": ""
        },
        "z": 1
      },
      {
        "id": "el_inv_customer_addr",
        "type": "text",
        "frame": {
          "xMm": 15,
          "yMm": 50,
          "wMm": 90,
          "hMm": 12
        },
        "binding": {
          "expr": "invoice.customer.address",
          "format": null,
          "fallback": ""
        },
        "z": 1
      },
      {
        "id": "el_inv_rule",
        "type": "shape",
        "shape": "line",
        "frame": {
          "xMm": 15,
          "yMm": 68,
          "wMm": 180,
          "hMm": 0
        },
        "style": {
          "stroke": {
            "color": "#94A3B8",
            "widthMm": 0.2,
            "style": "solid"
          }
        },
        "z": 0
      },
      {
        "id": "el_inv_table",
        "type": "dataTable",
        "frame": {
          "xMm": 15,
          "yMm": 74,
          "wMm": 180,
          "hMm": null
        },
        "source": {
          "arrayExpr": "invoice.lineItems"
        },
        "columns": [
          {
            "key": "desc",
            "header": "Description",
            "cell": {
              "expr": "$.description"
            },
            "widthMm": 90
          },
          {
            "key": "qty",
            "header": "Qty",
            "cell": {
              "expr": "$.quantity",
              "format": "number:0"
            },
            "widthMm": 20,
            "align": "right"
          },
          {
            "key": "unit",
            "header": "Unit Price",
            "cell": {
              "expr": "$.unitPrice",
              "format": "currency:USD"
            },
            "widthMm": 35,
            "align": "right"
          },
          {
            "key": "amt",
            "header": "Amount",
            "cell": {
              "expr": "$.amount",
              "format": "currency:USD"
            },
            "footer": {
              "expr": "$sum(invoice.lineItems.amount)",
              "format": "currency:USD"
            },
            "widthMm": 35,
            "align": "right"
          }
        ],
        "repeatHeaderOnEachPage": true,
        "keepTogether": false,
        "z": 1
      },
      {
        "id": "el_inv_total_label",
        "type": "text",
        "frame": {
          "xMm": 110,
          "yMm": 250,
          "wMm": 50,
          "hMm": 8
        },
        "text": "Total Due",
        "style": {
          "font": {
            "weight": "bold"
          },
          "align": {
            "horizontal": "right",
            "vertical": "middle"
          }
        },
        "z": 1
      },
      {
        "id": "el_inv_total",
        "type": "text",
        "frame": {
          "xMm": 160,
          "yMm": 250,
          "wMm": 35,
          "hMm": 8
        },
        "binding": {
          "expr": "invoice.total",
          "format": "currency:USD",
          "fallback": ""
        },
        "style": {
          "font": {
            "weight": "bold"
          },
          "align": {
            "horizontal": "right",
            "vertical": "middle"
          }
        },
        "z": 1
      }
    ]
  },
  "footer": {
    "elements": [
      {
        "id": "el_inv_page",
        "type": "text",
        "frame": {
          "xMm": 15,
          "yMm": 282,
          "wMm": 180,
          "hMm": 6
        },
        "text": "Page {{pageNumber}} of {{pageCount}}",
        "style": {
          "align": {
            "horizontal": "center",
            "vertical": "middle"
          }
        },
        "z": 1
      }
    ]
  }
}
